<!ELEMENT liste-interpretes (interprete*)>
<!ELEMENT interprete        (nom,prenom,siecle?)>
  <!ATTLIST interprete        index CDATA #REQUIRED>
<!ELEMENT nom               (#PCDATA)>
<!ELEMENT prenom            (#PCDATA)>
<!ELEMENT siecle            (#PCDATA)>
